{
  "contract": "ONSURE_LICENSE_STATE_V1",
  "license_id": "license-sample-001",
  "organization_id": "org-sample",
  "tenant_id": "tenant-sample",
  "workspace_id": "workspace-sample",
  "product_id": "ONSURE",
  "edition": "DEVELOPER",
  "status": "ACTIVE",
  "valid_from": "2026-07-01T00:00:00Z",
  "valid_until": "2027-07-01T00:00:00Z",
  "offline_grace_hours": 72,
  "clock_tolerance_seconds": 300,
  "last_observed_at": "2026-07-26T00:00:00Z",
  "last_online_validation_at": "2026-07-26T00:00:00Z",
  "entitlements": ["APPROVED_IMPROVEMENT", "PROGRAM_LEARNING", "VALIDATION"],
  "credits": {"total": 1000, "available": 900, "reserved": 100, "committed": 0},
  "reservations": {
    "reservation-sample-001": {
      "reservation_id": "reservation-sample-001",
      "credits": 100,
      "state": "RESERVED",
      "created_at": "2026-07-26T00:00:00Z",
      "expires_at": "2026-07-27T00:00:00Z"
    }
  },
  "revision": 3,
  "ledger_sequence": 3,
  "ledger_head": "bbbbbbbbbbbbbbbbbbbbbbbbbbbbbbbbbbbbbbbbbbbbbbbbbbbbbbbbbbbbbbbb",
  "created_at": "2026-07-01T00:00:00Z",
  "updated_at": "2026-07-26T00:00:00Z",
  "final_claim_allowed": false,
  "state_sha256": "aaaaaaaaaaaaaaaaaaaaaaaaaaaaaaaaaaaaaaaaaaaaaaaaaaaaaaaaaaaaaaaa"
}